{
  "command": "save_demo_design",
  "schema": "vandesign.runner.job/1",
  "job_id": "vd-vehicle-valid-save-20261015",
  "args": {
    "demo_id": "vd-vehicle-valid-create-20261015",
    "project_id": "a.YnVzaW5lc3M6Z21haWw2OTE3MDc5IzIwMjYwNzI3MTExODg3NDA4MQ",
    "folder_id": "urn:adsk.wipprod:fs.folder:co.gWxsBe8pRiiQCVWk3LBryQ",
    "name": "VanDesign-Vehicle-Space-Demo-20261015"
  },
  "created_utc": "2026-10-15T01:07:52.676+00:00"
}